{
  "$schema": "https://json-schema.org/draft/2020-12/schema",
  "type": "object",
  "properties": {
    "id": {
      "type": "string"
    },
    "slug": {
      "type": "string"
    },
    "icon": {
      "type": "string"
    },
    "category": {
      "type": "string",
      "enum": [
        "word",
        "logic",
        "strategy",
        "arcade",
        "memory",
        "skill",
        "puzzle"
      ]
    },
    "featured": {
      "default": false,
      "type": "boolean"
    },
    "color": {
      "type": "string"
    },
    "en": {
      "type": "object",
      "properties": {
        "name": {
          "type": "string"
        },
        "desc": {
          "type": "string"
        },
        "description": {
          "type": "string"
        },
        "objectives": {
          "type": "string"
        },
        "howToPlay": {
          "type": "string"
        },
        "rules": {
          "type": "object",
          "properties": {
            "controls": {
              "type": "string"
            },
            "mechanics": {
              "type": "array",
              "items": {
                "type": "string"
              }
            },
            "features": {
              "type": "array",
              "items": {
                "type": "string"
              }
            }
          }
        },
        "tips": {
          "type": "array",
          "items": {
            "type": "string"
          }
        },
        "faq": {
          "type": "array",
          "items": {
            "type": "object",
            "properties": {
              "question": {
                "type": "string"
              },
              "answer": {
                "type": "string"
              }
            },
            "required": [
              "question",
              "answer"
            ]
          }
        }
      },
      "required": [
        "name",
        "desc"
      ]
    },
    "zh": {
      "type": "object",
      "properties": {
        "name": {
          "type": "string"
        },
        "desc": {
          "type": "string"
        },
        "description": {
          "type": "string"
        },
        "objectives": {
          "type": "string"
        },
        "howToPlay": {
          "type": "string"
        },
        "rules": {
          "type": "object",
          "properties": {
            "controls": {
              "type": "string"
            },
            "mechanics": {
              "type": "array",
              "items": {
                "type": "string"
              }
            },
            "features": {
              "type": "array",
              "items": {
                "type": "string"
              }
            }
          }
        },
        "tips": {
          "type": "array",
          "items": {
            "type": "string"
          }
        },
        "faq": {
          "type": "array",
          "items": {
            "type": "object",
            "properties": {
              "question": {
                "type": "string"
              },
              "answer": {
                "type": "string"
              }
            },
            "required": [
              "question",
              "answer"
            ]
          }
        }
      },
      "required": [
        "name",
        "desc"
      ]
    },
    "$schema": {
      "type": "string"
    }
  },
  "required": [
    "id",
    "slug",
    "icon",
    "category",
    "color",
    "en"
  ]
}