{
  "id": "game2048",
  "slug": "2048",
  "icon": "🔢",
  "category": "logic",
  "featured": true,
  "color": "from-amber-500 to-orange-600",
  "en": {
    "name": "2048",
    "desc": "Slide numbered tiles to merge them! When two tiles with the same number touch, they combine into one. Reach the 2048 tile to win this addictive puzzle game.",
    "howToPlay": "Use arrow keys (or swipe on mobile) to slide all tiles in that direction. Tiles with the same value merge when they collide. A new tile (2 or 4) appears after each move. The game ends when no more moves are possible.",
    "tips": [
      "Keep your highest tile in a corner and build around it",
      "Never move your highest tile away from its corner",
      "Try to keep tiles in descending order along one edge",
      "Plan ahead - each move affects the entire board"
    ]
  },
  "zh": {
    "name": "2048",
    "desc": "滑动数字方块合并它们！当两个相同数字的方块相碰时，它们会合并成一个。达到2048方块赢得这款令人上瘾的益智游戏。",
    "howToPlay": "使用方向键（或在手机上滑动）向该方向滑动所有方块。相同数值的方块碰撞时会合并。每次移动后会出现一个新方块（2或4）。当无法再移动时游戏结束。",
    "tips": [
      "将最大的方块保持在角落，并在周围构建",
      "永远不要将最大的方块移出角落",
      "尽量让方块沿一条边按降序排列",
      "提前规划——每一步都会影响整个棋盘"
    ]
  }
}